{
  "created_at_utc": "2026-08-11T12:06:20.505Z",
  "manifest_id": "codex-miniwob-source-manifest-20260811",
  "schema_version": "cui-source-manifest-v1",
  "sources": [
    {
      "access_class": "first_party_public",
      "byte_count": 2524,
      "license": {
        "identifier": "MIT (user-authorized original work)",
        "license_url": null,
        "redistribution": "allowed"
      },
      "locator": {
        "kind": "repository_path",
        "value": "configs/codex-case.json"
      },
      "retrieved_at_utc": "2026-08-11T12:06:20.505Z",
      "sha256": "db0e70ef9ee4418fd4683e7e258305881cbb4d21c01ef873b541ece7e4b6fb9f",
      "source_id": "codex-case-config",
      "source_type": "repository_file",
      "title": "Codex exploratory case protocol"
    },
    {
      "access_class": "first_party_public",
      "byte_count": 35779,
      "license": {
        "identifier": "MIT (user-authorized original work)",
        "license_url": null,
        "redistribution": "allowed"
      },
      "locator": {
        "kind": "repository_path",
        "value": "experiments/codex_case/runner.py"
      },
      "retrieved_at_utc": "2026-08-11T12:06:20.505Z",
      "sha256": "513ab33e98656d23f6d59bd3d975957b2093970b136c29fbfc9c232792827b77",
      "source_id": "codex-case-runner",
      "source_type": "repository_file",
      "title": "Codex exploratory case runner"
    },
    {
      "access_class": "first_party_public",
      "byte_count": 257699,
      "license": {
        "identifier": "MIT (user-authorized original work)",
        "license_url": null,
        "redistribution": "allowed"
      },
      "locator": {
        "kind": "repository_path",
        "value": "recorder"
      },
      "retrieved_at_utc": "2026-08-11T12:06:20.505Z",
      "sha256": "f57bae243ebc1d59e48a752090d20a1eb148459826a2b2b370db12438e21b0f6",
      "source_id": "cui-recorder-0.4.0",
      "source_type": "software_release",
      "title": "CUI Trace Recorder 0.4.0 source tree"
    },
    {
      "access_class": "external_public",
      "byte_count": 4988688,
      "license": {
        "identifier": "MIT",
        "license_url": "https://github.com/Farama-Foundation/miniwob-plusplus/blob/master/LICENSE",
        "redistribution": "allowed"
      },
      "locator": {
        "kind": "https_url",
        "value": "https://github.com/Farama-Foundation/miniwob-plusplus"
      },
      "retrieved_at_utc": "2026-08-11T12:06:20.505Z",
      "sha256": "9883c9117804c0865920b3313021a0bd0cccc094f2f707678f6c3a72b3af4f3a",
      "source_id": "miniwob-plusplus-7fd85d71",
      "source_type": "software_release",
      "title": "MiniWoB++ pinned benchmark source"
    }
  ]
}
