{
  "schema_version": "cui-source-manifest-v1",
  "manifest_id": "fixture-sources",
  "created_at_utc": "2026-08-11T00:00:00Z",
  "sources": [
    {
      "source_id": "fixture-paper",
      "title": "Fixture source",
      "source_type": "paper",
      "access_class": "external_public",
      "locator": {
        "kind": "https_url",
        "value": "https://doi.org/10.0000/fixture"
      },
      "retrieved_at_utc": "2026-08-11T00:00:00Z",
      "sha256": "0000000000000000000000000000000000000000000000000000000000000000",
      "byte_count": 0,
      "license": {
        "identifier": "CC0-1.0",
        "license_url": "https://creativecommons.org/publicdomain/zero/1.0",
        "redistribution": "allowed"
      }
    }
  ]
}
